{
  "$schema": "../../schemas/model-ir-v1.schema.json",
  "irVersion": "1.0.0",
  "id": "EdNoProducer",
  "module": "KCF",
  "namespace": "cov",
  "profile": "event-driven-system",
  "profiles": [
    "event-driven-system"
  ],
  "concepts": [
    {
      "id": "OrderPlaced",
      "qualifiedName": "cov.OrderPlaced",
      "kind": "EVENT"
    }
  ]
}
