{
  "$schema": "../../schemas/model-ir-v1.schema.json",
  "irVersion": "1.0.0",
  "id": "OpFull",
  "module": "KCF",
  "namespace": "cov",
  "profile": "operational-system",
  "profiles": [
    "operational-system"
  ],
  "concepts": [
    {
      "id": "Dispatcher",
      "qualifiedName": "cov.Dispatcher",
      "kind": "ACTOR"
    },
    {
      "id": "FulfillOrder",
      "qualifiedName": "cov.FulfillOrder",
      "kind": "WORK"
    }
  ]
}
