{
  "$schema": "../../schemas/model-ir-v1.schema.json",
  "irVersion": "1.0.0",
  "id": "AiNoSection",
  "module": "KCF",
  "namespace": "cov",
  "profile": "ai-application",
  "profiles": [
    "ai-application"
  ],
  "concepts": [
    {
      "id": "Feature",
      "qualifiedName": "cov.Feature",
      "kind": "INFORMATION"
    }
  ]
}
