{
  "$schema": "../../schemas/model-ir-v1.schema.json",
  "irVersion": "1.0.0",
  "id": "AnNoMeasure",
  "module": "KCF",
  "namespace": "cov",
  "profile": "analytics-platform",
  "profiles": [
    "analytics-platform"
  ],
  "concepts": [
    {
      "id": "SalesRecord",
      "qualifiedName": "cov.SalesRecord",
      "kind": "INFORMATION"
    }
  ]
}
